<!ELEMENT Customers (Customer+)>
<!ELEMENT Customer (id,name,salary,copyright,comment)>
<!ELEMENT id (#PCDATA)>
<!ELEMENT name (#PCDATA)>
<!ELEMENT salary (#PCDATA)>
<!ELEMENT copyright (#PCDATA)>
<!ELEMENT comment (#PCDATA)>
<!ATTLIST Customer ssn CDATA 'sr009'>


